{
  "/Users/minseolee/Desktop/g2-clone/backend/serverless.yml": {
    "versionFramework": "4.23.0",
    "servicePath": "/Users/minseolee/Desktop/g2-clone/backend/serverless.yml",
    "serviceConfigFileName": "serverless.yml",
    "service": {
      "service": "g2-chatbot-backend",
      "provider": {
        "name": "aws",
        "runtime": "python3.9",
        "region": "us-east-1",
        "stage": "prod",
        "environment": {
          "BIGKINDS_API_KEY": "<REDACTED>"
        },
        "iamRoleStatements": [
          {
            "Effect": "Allow",
            "Action": [
              "logs:CreateLogGroup",
              "logs:CreateLogStream",
              "logs:PutLogEvents"
            ],
            "Resource": "*"
          }
        ]
      },
      "functions": {
        "chatbot": {
          "handler": "lambda/chatbot-handler.lambda_handler",
          "timeout": 30,
          "memorySize": 256,
          "events": [
            {
              "http": {
                "path": "/chat",
                "method": "post",
                "cors": {
                  "origin": "*",
                  "headers": [
                    "Content-Type",
                    "X-Amz-Date",
                    "Authorization",
                    "X-Api-Key",
                    "X-Amz-Security-Token"
                  ],
                  "allowCredentials": "<REDACTED>"
                }
              }
            },
            {
              "http": {
                "path": "/chat",
                "method": "options",
                "cors": {
                  "origin": "*",
                  "headers": [
                    "Content-Type",
                    "X-Amz-Date",
                    "Authorization",
                    "X-Api-Key",
                    "X-Amz-Security-Token"
                  ],
                  "allowCredentials": "<REDACTED>"
                }
              }
            }
          ]
        }
      },
      "plugins": [
        "serverless-python-requirements"
      ],
      "custom": {
        "pythonRequirements": {
          "dockerizePip": false
        }
      }
    },
    "provider": {
      "name": "aws",
      "runtime": "python3.9",
      "region": "us-east-1",
      "stage": "prod",
      "environment": {
        "BIGKINDS_API_KEY": "<REDACTED>"
      },
      "iamRoleStatements": [
        {
          "Effect": "Allow",
          "Action": [
            "logs:CreateLogGroup",
            "logs:CreateLogStream",
            "logs:PutLogEvents"
          ],
          "Resource": "*"
        }
      ]
    },
    "error": {
      "message": "You must sign in or use a license key with Serverless Framework V.4 and later versions. Please use \"serverless login\".",
      "stack": "Error: You must sign in or use a license key with Serverless Framework V.4 and later versions. Please use \"serverless login\".\n    at Authentication.getAuthenticatedData (file:///Users/minseolee/.serverless/releases/4.23.0/package/dist/sf-core.js:717:11184)\n    at process.processTicksAndRejections (node:internal/process/task_queues:105:5)\n    at async Authentication.authenticate (file:///Users/minseolee/.serverless/releases/4.23.0/package/dist/sf-core.js:720:4103)\n    at async TraditionalRunner.resolveVariablesAndAuthenticate (file:///Users/minseolee/.serverless/releases/4.23.0/package/dist/sf-core.js:729:1380)\n    at async TraditionalRunner.run (file:///Users/minseolee/.serverless/releases/4.23.0/package/dist/sf-core.js:1356:27989)\n    at async route (file:///Users/minseolee/.serverless/releases/4.23.0/package/dist/sf-core.js:1531:2878)\n    at async Object.run (file:///Users/minseolee/.serverless/releases/4.23.0/package/dist/sf-core.js:1532:3845)\n    at async run2 (file:///Users/minseolee/.serverless/releases/4.23.0/package/dist/sf-core.js:1532:4999)"
    },
    "serviceRawFile": "service: g2-chatbot-backend\n\nprovider:\n  name: aws\n  runtime: python3.9\n  region: us-east-1\n  stage: prod\n  environment:\n    BIGKINDS_API_KEY: ${env:BIGKINDS_API_KEY}\n  iamRoleStatements:\n    - Effect: Allow\n      Action:\n        - logs:CreateLogGroup\n        - logs:CreateLogStream\n        - logs:PutLogEvents\n      Resource: \"*\"\n\nfunctions:\n  chatbot:\n    handler: lambda/chatbot-handler.lambda_handler\n    timeout: 30\n    memorySize: 256\n    events:\n      - http:\n          path: /chat\n          method: post\n          cors:\n            origin: '*'\n            headers:\n              - Content-Type\n              - X-Amz-Date\n              - Authorization\n              - X-Api-Key\n              - X-Amz-Security-Token\n            allowCredentials: false\n      - http:\n          path: /chat\n          method: options\n          cors:\n            origin: '*'\n            headers:\n              - Content-Type\n              - X-Amz-Date\n              - Authorization\n              - X-Api-Key\n              - X-Amz-Security-Token\n            allowCredentials: false\n\nplugins:\n  - serverless-python-requirements\n\ncustom:\n  pythonRequirements:\n    dockerizePip: false",
    "command": [
      "deploy"
    ],
    "options": {},
    "serviceProviderAwsCfStackId": null,
    "serviceProviderAwsCfStackCreated": null,
    "serviceProviderAwsCfStackUpdated": null,
    "serviceProviderAwsCfStackStatus": null,
    "serviceProviderAwsCfStackOutputs": null
  }
}